{
  "schema": "video-paper-wiki.code-evidence-manifest.v1",
  "state": "proposal",
  "origin": {
    "repository": "Owner/Repo",
    "commit": "aaaaaaaaaaaaaaaaaaaaaaaaaaaaaaaaaaaaaaaa",
    "path": "src/model.py"
  },
  "payload": {
    "sha256": "953bba9ac9726eaea07e844abcf144a0afe998039257c7a88b6665819597f39d",
    "size_bytes": 5
  },
  "media_type": "text/plain",
  "encoding": "utf-8",
  "line_canonicalization": "utf8-lf-v1",
  "newline_style": "mixed",
  "ends_with_newline": true,
  "line_count": 2,
  "normalized_sha256": "911169ddaaf146aff539f58c26c489af3b892dff0fe283c1c264c65ae5aa59a2",
  "proposal_sha256": "e6bf9f5a5cd3901262e3cc637449c7152f8beb2ab4d48201747fbe68d356422b"
}
